{
  "name": "evidence-lab-plugins",
  "description": "Evidence Lab agent-first research packs for Claude Code and Codex.",
  "owner": {
    "name": "Evidence Lab"
  },
  "plugins": [
    {
      "name": "evidence-lab-core",
      "description": "Agent-first research foundations, fast researcher onboarding, personal skill creation, reproducible pack selection, source verification, citation handling, and scientific critical thinking.",
      "version": "0.14.0",
      "author": {
        "name": "Evidence Lab"
      },
      "source": "./packs/core/evidence-lab-core",
      "category": "research",
      "keywords": [
        "onboarding",
        "pack-selection",
        "companion-plugin-planning",
        "installation-lifecycle",
        "personal-skill-authoring",
        "paper-lookup",
        "citation-management",
        "critical-thinking"
      ]
    },
    {
      "name": "life-sciences",
      "description": "Domain checks for life-science protocols, biological controls, bias, biosafety boundaries, reporting context, and image acquisition metadata.",
      "version": "0.1.2",
      "author": {
        "name": "Evidence Lab"
      },
      "source": "./packs/domains/life-sciences",
      "category": "research",
      "keywords": [
        "life-science-protocols"
      ]
    },
    {
      "name": "quantitative-sciences",
      "description": "Statistical analysis, power and sample-size planning, uncertainty and units, and publication-grade scientific visualization for quantitative research.",
      "version": "0.4.0",
      "author": {
        "name": "Evidence Lab"
      },
      "source": "./packs/domains/quantitative-sciences",
      "category": "research",
      "keywords": [
        "statistical-analysis",
        "statistical-power",
        "uncertainty-and-units",
        "scientific-visualization"
      ]
    },
    {
      "name": "data-and-pdf",
      "description": "Compatibility entry point for mixed document-and-data projects; installs focused document-evidence and structured-data-analysis packs as dependencies.",
      "version": "1.0.2",
      "author": {
        "name": "Evidence Lab"
      },
      "source": "./packs/workflows/data-and-pdf",
      "category": "research",
      "keywords": [
        "data-and-pdf-compatibility"
      ]
    },
    {
      "name": "document-evidence",
      "description": "Reproducible conversion of supported research documents into inspectable Markdown without installing database retrieval or dataset analysis tools.",
      "version": "0.2.0",
      "author": {
        "name": "Evidence Lab"
      },
      "source": "./packs/workflows/document-evidence",
      "category": "research",
      "keywords": [
        "document-conversion"
      ]
    },
    {
      "name": "evidence-lab-meeting-capture",
      "description": "Turn Evidence Lab meeting transcripts or notes into source-bounded summaries and register each completed summary in the canonical Notion meeting database.",
      "version": "0.1.0",
      "author": {
        "name": "Evidence Lab"
      },
      "source": "./packs/workflows/evidence-lab-meeting-capture",
      "category": "research",
      "keywords": [
        "evidence-lab-meeting-capture"
      ]
    },
    {
      "name": "full-research-cycle",
      "description": "Compatibility entry point for the complete research cycle; installs the focused research-design and literature-publication packs as declared dependencies.",
      "version": "1.0.2",
      "author": {
        "name": "Evidence Lab"
      },
      "source": "./packs/workflows/full-research-cycle",
      "category": "research",
      "keywords": [
        "full-research-cycle-compatibility"
      ]
    },
    {
      "name": "literature-publication",
      "description": "Literature synthesis, evidence-bounded academic writing, editable research diagrams, and manuscript review without installing study-design procedures.",
      "version": "0.2.0",
      "author": {
        "name": "Evidence Lab"
      },
      "source": "./packs/workflows/literature-publication",
      "category": "research",
      "keywords": [
        "literature-review",
        "academic-writing",
        "peer-review",
        "research-diagrams"
      ]
    },
    {
      "name": "publication-monitoring",
      "description": "Repeatable monitoring of new scholarly publications with explicit queries, stable deduplication, checkpoints, and source-linked update digests.",
      "version": "0.1.2",
      "author": {
        "name": "Evidence Lab"
      },
      "source": "./packs/workflows/publication-monitoring",
      "category": "research",
      "keywords": [
        "publication-monitoring"
      ]
    },
    {
      "name": "qualitative-research",
      "description": "Traceable qualitative-text analysis using an explicit codebook, coded excerpts, reflexive notes, disagreements, and evidence-bounded thematic synthesis.",
      "version": "0.2.0",
      "author": {
        "name": "Evidence Lab"
      },
      "source": "./packs/workflows/qualitative-research",
      "category": "research",
      "keywords": [
        "qualitative-analysis"
      ]
    },
    {
      "name": "research-design",
      "description": "Testable hypothesis development and reproducible experimental or observational study design without unrelated literature or manuscript tooling.",
      "version": "0.2.0",
      "author": {
        "name": "Evidence Lab"
      },
      "source": "./packs/workflows/research-design",
      "category": "research",
      "keywords": [
        "hypothesis-generation",
        "study-design"
      ]
    },
    {
      "name": "research-images",
      "description": "Research-image inspection with explicit source identity, transformation history, measurement definitions, exclusions, and interpretation boundaries.",
      "version": "0.2.0",
      "author": {
        "name": "Evidence Lab"
      },
      "source": "./packs/workflows/research-images",
      "category": "research",
      "keywords": [
        "research-image-analysis"
      ]
    },
    {
      "name": "structured-data-analysis",
      "description": "Reproducible public-database retrieval and exploratory analysis for tables and datasets without unrelated document-conversion tooling.",
      "version": "0.2.0",
      "author": {
        "name": "Evidence Lab"
      },
      "source": "./packs/workflows/structured-data-analysis",
      "category": "research",
      "keywords": [
        "database-lookup",
        "exploratory-data-analysis"
      ]
    },
    {
      "name": "systematic-review",
      "description": "Reproducible systematic-search and screening workflow with explicit eligibility criteria, stable record deduplication, and an auditable decision trail.",
      "version": "0.2.0",
      "author": {
        "name": "Evidence Lab"
      },
      "source": "./packs/workflows/systematic-review",
      "category": "research",
      "keywords": [
        "systematic-search",
        "screening-and-deduplication"
      ]
    }
  ]
}
